<?xml version="1.0" encoding="UTF-8"?>
<?xml-stylesheet type="text/xsl" href="test.xsl"?>
<Testing xmlns:xsi="http://www.w3.org/2001/XMLSchema-instance" 
xsi:noNamespaceSchemaLocation="Testing.xsd">
  <Employee>
    <Name>Ankur</Name>
    <Emp_Id>23</Emp_Id>
    <Address>mysore</Address>
    <Testing_cycle>2</Testing_cycle>
  </Employee>
  <Employee>
    <Name>Priyanka</Name>
    <Emp_Id>22</Emp_Id>
    <Address>Blr</Address>
    <Testing_cycle>1</Testing_cycle>
  </Employee>
  <Employee>
    <Name>Jeetank</Name>
    <Emp_Id>22</Emp_Id>
    <Address>Npr</Address>
    <Testing_cycle>4</Testing_cycle>
  </Employee>
  <Employee>
    <Name>Akshay</Name>
    <Emp_Id>21</Emp_Id>
    <Address>Delhi</Address>
    <Testing_cycle>3</Testing_cycle>
  </Employee>
  <Employee>
    <Name>Amber</Name>
    <Emp_Id>22</Emp_Id>
    <Address>Jhkd</Address>
    <Testing_cycle>2</Testing_cycle>
  </Employee>
  <Employee>
    <Name>zidane</Name>
    <Emp_Id>22</Emp_Id>
    <Address>RM</Address>
    <Testing_cycle>2</Testing_cycle>
  </Employee>
</Testing>